<?xml version="1.0" encoding="UTF-8"?>
<!--
  ~ Copyright 2018 CapTech Ventures, Inc.
  ~
  ~ Licensed under the Apache License, Version 2.0 (the "License");
  ~ you may not use this file except in compliance with the License.
  ~ You may obtain a copy of the License at
  ~
  ~     http://www.apache.org/licenses/LICENSE-2.0
  ~
  ~ Unless required by applicable law or agreed to in writing, software
  ~ distributed under the License is distributed on an "AS IS" BASIS,
  ~ WITHOUT WARRANTIES OR CONDITIONS OF ANY KIND, either express or implied.
  ~ See the License for the specific language governing permissions and
  ~ limitations under the License.
  -->

<schema xmlns="http://www.w3.org/2001/XMLSchema" targetNamespace="http://www.captechconsulting.com/sample-schema"
	xmlns:tns="http://www.captechconsulting.com/sample-schema" elementFormDefault="qualified">

    <element name="meter">
    	<annotation>
    		<documentation>Represents a meter with its readings over time.</documentation>
    	</annotation>
    	<complexType>
    		<sequence>
    			<element name="readings" type="tns:meter-readings" minOccurs="1" maxOccurs="1">
    				<annotation>
    					<documentation>a set of meter readings</documentation>
    				</annotation>
    			</element>
    			<element name="documentation" type="string"/>
    		</sequence>
    		<attribute name="number" type="string" use="required"/>
    		<attribute name="address" type="string" use="required"/>
    	</complexType>
    </element>

    <complexType name="meter-readings">
    	<sequence>
    		<element name="reading" minOccurs="0" maxOccurs="unbounded">
    			<annotation>
    				<documentation>represents a reading at a point in time</documentation>
    			</annotation>
    			<complexType>
    				<attribute name="timestamp" type="string" use="required">
    					<annotation>
    						<documentation>time of the reading</documentation>
    					</annotation>
    				</attribute>
    				<attribute name="value" type="decimal">
    					<annotation>
    						<documentation>value of the reading</documentation>
    					</annotation>
    				</attribute>
    			</complexType>
    		</element>
    	</sequence>
    </complexType>
</schema>