<?xml version="1.0" encoding="UTF-8"?>
<!--
  ~ Copyright 2018 CapTech Ventures, Inc.
  ~
  ~ Licensed under the Apache License, Version 2.0 (the "License");
  ~ you may not use this file except in compliance with the License.
  ~ You may obtain a copy of the License at
  ~
  ~     http://www.apache.org/licenses/LICENSE-2.0
  ~
  ~ Unless required by applicable law or agreed to in writing, software
  ~ distributed under the License is distributed on an "AS IS" BASIS,
  ~ WITHOUT WARRANTIES OR CONDITIONS OF ANY KIND, either express or implied.
  ~ See the License for the specific language governing permissions and
  ~ limitations under the License.
  -->

<tns:meter address="meter address" number="meter number" xmlns:tns="http://www.captechconsulting.com/sample-schema" xmlns:xsi="http://www.w3.org/2001/XMLSchema-instance" xsi:schemaLocation="http://www.captechconsulting.com/sample-schema sample-schema.xsd ">
  <tns:readings>
    <tns:reading timestamp="2017-06-01T12:30:04-04:00" value="1.0"/>
    <tns:reading timestamp="2017-06-01T13:00:05-04:00" value="2.0"/>
    <tns:reading timestamp="2017-06-01T13:30:06-04:00" value="3.0"/>
    <tns:reading timestamp="2017-06-01T14:00:07-04:00" value="4.0"/>
    <tns:reading timestamp="2017-06-01T14:30:08-04:00" value="5.0"/>
  </tns:readings>
  <tns:documentation>Here's some documentation text</tns:documentation>
</tns:meter>
